{
    "schema_version": "v1",
    "name_for_human": "Weather Information Plugin",
    "name_for_model": "weatherInfo",
    "description_for_human": "Plugin for retrieving weather information for a specified city. You can get wind speed, pressure, humidity, region, country, and local time.",
    "description_for_model": "Plugin for retrieving weather information for a specified city. You can get wind speed, pressure, humidity, region, country, and local time.",
    "auth": {
        "type": "none"
    },
    "api": {
        "type": "openapi",
        "url": "https://gpt-test-pluign.herokuapp.com/openapi.yaml",
        "is_user_authenticated": false
    },
    "logo_url": "https://gpt-test-pluign.herokuapp.com/logo.png",
    "contact_email": "gbadebo.bello@postman.com",
    "legal_info_url": "https://github.com/Gbahdeyboh"
}
